テストファイルNo.,実装方法タイトル,対象,見解,代替もしくは推奨する方法,注意点,備考,
達成基準 7.2.1.1 キーボード操作,,,,,,,
H91-1c,H91: HTMLのフォーム・コントロール及びリンクを用いる,a要素,要注意,可能な場合には、リンクをすべて画像にするか、またはすべてテキストにしたほうがよい。,"一つのリンク内で画像とテキストを両方用いる場合、画像のalt属性値に代替テキストが記述されている場合、スクリーンリーダーのPC-Talker XPとNetReader、FocusTalk、VoiceOverではその代替テキストが読み上げられない。
",今後の支援技術の機能向上に期待する（PC-Talker 7では、代替テキストも読み上げられるように改善されている）。,
SCR20-1,SCR20: キーボードとその他のデバイス特有の機能を両方とも用いる,イベントハンドラ（mousedown + keydown）,要注意,,"JAWSではサポートされていない。
実装方法によっては、次のリンクへ移動しようとしてTabキーを押しても反応してしまうことがある。用途によっては、Tabキーには反応しないようにするなどの工夫が必要である。",,
SCR20-2,SCR20: キーボードとその他のデバイス特有の機能を両方とも用いる,イベントハンドラ（mouseup + keyup）,達成不可能,,スクリーンリーダーによるサポートが全般的に不十分である。,,
SCR20-4,SCR20: キーボードとその他のデバイス特有の機能を両方とも用いる,イベントハンドラ（mouseover + focus）,要注意,,"HPRではサポートされていない。
実装方法によってはキーボード操作でフォーカスが閉じ込められてしまうこともあるので、しっかりと動作確認を行う必要がある。また、onmouseoverとonkeypressは、iPhoneやiPadなどのタッチパネル・インタフェースでは意図通りに動作しないことがあるため、注意が必要である。",,
SCR20-5,SCR20: キーボードとその他のデバイス特有の機能を両方とも用いる,イベントハンドラ（mouseout + blur）,要注意,,スクリーンリーダーによっては、適切に動作しないことがある。,,
SCR26,SCR26: 動的なコンテンツをDOMのそのトリガーとなる要素の直後に挿入する,DOM操作でリンクの後に挿入される要素,達成可能,,ほとんどのスクリーンリーダーでは問題ないが、HPRでは読み上げがページの先頭に戻ってしまうという問題がある。HPRは既にサポートされていない古いスクリーンリーダーであるが、対応させる必要がある場合は注意が必要。,,
